{
  "$schema": "https://raw.githubusercontent.com/runstudio/agentproof/main/schemas/agentproof.config.schema.json",
  "profile": "strict",
  "failUnder": 95,
  "maxFiles": 2000,
  "commandTimeoutSeconds": 240,
  "baseline": ".agentproof/baseline.json",
  "ignore": [
    "fixtures",
    "snapshots",
    "generated"
  ],
  "commands": [],
  "budgets": {
    "critical": 0,
    "high": 0,
    "medium": 3,
    "low": 15
  },
  "severityOverrides": {
    "security.unsafe-html": "high",
    "security.env-committed": "critical",
    "claims.done-conflicts-with-findings": "critical"
  },
  "suppressions": []
}
